[
    {
        "id":  "sega",
        "label":  "SEGA",
        "group":  "company",
        "summary":  "Sega Corporation is a Japanese video game company and subsidiary of Sega Sammy Holdings headquartered in Tokyo. It produces several multi-million-selling game franchises for arcades and consoles, including Sonic the Hedgehog, Virtua Fighter, The House of the Dead, and Yakuza. From 1983 until 2001, Sega also developed its own consoles.",
        "founded":  1960,
        "headquarters":  "Shinagawa, Tokyo, Japan",
        "wikipediaUrl":  "https://en.wikipedia.org/wiki/Sega",
        "wikidataId":  "Q122741",
        "thumbnail":  "https://upload.wikimedia.org/wikipedia/commons/thumb/3/32/Osaki_Garden_Tower.jpg/330px-Osaki_Garden_Tower.jpg"
    },
    {
        "id":  "sega-am1",
        "label":  "Sega AM1",
        "group":  "studio",
        "summary":  "Sega AM Research \u0026 Development No. 1 is a development department within Sega Corporation that also previously existed as Wow Entertainment and Sega Wow Inc. AM1 spent most of its early existence under the leadership of Rikiya Nakagawa and developed a number of arcade games for Sega, including The House of the Dead series.",
        "founded":  1990,
        "defunct":  null,
        "status":  "active",
        "focus":  "Arcade light gun shooters and action games",
        "wikipediaUrl":  "https://en.wikipedia.org/wiki/Sega_AM1",
        "wikidataId":  "Q339565",
        "thumbnail":  "https://upload.wikimedia.org/wikipedia/en/thumb/5/5d/Sega_AM1_logo.png/330px-Sega_AM1_logo.png"
    },
    {
        "id":  "sega-am2",
        "label":  "Sega AM2",
        "group":  "studio",
        "summary":  "Sega AM Research \u0026 Development No. 2 is a video game development team within Sega. Yu Suzuki, who had previously developed arcade games including Hang-On and Out Run, was the first manager of the department. AM2 is responsible for many of Sega\u0027s most iconic arcade franchises including Virtua Fighter, Daytona USA, and After Burner.",
        "founded":  1983,
        "defunct":  null,
        "status":  "active",
        "focus":  "Arcade fighting, racing, and simulation games",
        "wikipediaUrl":  "https://en.wikipedia.org/wiki/Sega_AM2",
        "wikidataId":  "Q294587",
        "thumbnail":  "https://upload.wikimedia.org/wikipedia/en/thumb/c/c2/Sega_AM2_logo.png/330px-Sega_AM2_logo.png"
    },
    {
        "id":  "sega-am3",
        "label":  "Sega AM3",
        "group":  "studio",
        "summary":  "Sega AM Research \u0026 Development No. 3, known as Hitmaker Co., Ltd. from 2000 to 2004, was a division of Sega. Established by 1993, AM3 was managed by Hisao Oguchi and developed a number of arcade games including Virtual On, Sega Rally, Crazy Taxi, and Virtua Tennis.",
        "founded":  1993,
        "defunct":  2004,
        "status":  "defunct",
        "focus":  "Arcade racing, mech combat, and sports games",
        "wikipediaUrl":  "https://en.wikipedia.org/wiki/Sega_AM3",
        "wikidataId":  "Q3082031",
        "thumbnail":  "https://upload.wikimedia.org/wikipedia/commons/thumb/d/dd/Hitmaker_Logo.svg/330px-Hitmaker_Logo.svg.png"
    },
    {
        "id":  "sonic-team",
        "label":  "Sonic Team",
        "group":  "studio",
        "summary":  "Sega CS R\u0026D Dept. No. 2, doing business as Sonic Team, is a Japanese video game developer owned by Sega. Sonic Team is best known for its Sonic the Hedgehog series. Some Sonic Team games, such as the original Sonic games and Nights into Dreams, are considered among the best video games ever made.",
        "founded":  1990,
        "defunct":  null,
        "status":  "active",
        "focus":  "Sonic the Hedgehog franchise and action-platformer games",
        "wikipediaUrl":  "https://en.wikipedia.org/wiki/Sonic_Team",
        "wikidataId":  "Q1140960",
        "thumbnail":  null
    },
    {
        "id":  "ryu-ga-gotoku-studio",
        "label":  "Ryu Ga Gotoku Studio",
        "group":  "studio",
        "summary":  "Sega CS R\u0026D Dept. No. 1, doing business as Ryu Ga Gotoku Studio, is a Japanese video game developer and a division of Sega. Formerly known as Amusement Vision (2000-2004), the studio developed Monkey Ball for arcades. It is now known for developing the Like a Dragon series and the Super Monkey Ball series.",
        "founded":  2000,
        "defunct":  null,
        "status":  "active",
        "focus":  "Arcade puzzle games and action-adventure games",
        "wikipediaUrl":  "https://en.wikipedia.org/wiki/Ryu_Ga_Gotoku_Studio",
        "wikidataId":  "Q18415238",
        "thumbnail":  "https://upload.wikimedia.org/wikipedia/en/thumb/d/da/Ryu_Ga_Gotoku_Studio.svg/330px-Ryu_Ga_Gotoku_Studio.svg.png"
    },
    {
        "id":  "smilebit",
        "label":  "Smilebit",
        "group":  "studio",
        "summary":  "Sega Sports Research and Development, previously known as Smilebit, was a development division of Sega. One of nine semi-autonomous studios Sega established in 2000, Smilebit was known for its sports simulation titles and Jet Set Radio. Previously known as R\u0026D6 or AM6.",
        "founded":  2000,
        "defunct":  2004,
        "status":  "defunct",
        "focus":  "Sports simulations and experimental titles",
        "wikipediaUrl":  "https://en.wikipedia.org/wiki/Sega_Sports_R%26D",
        "wikidataId":  "Q24188",
        "thumbnail":  null
    },
    {
        "id":  "united-game-artists",
        "label":  "United Game Artists",
        "group":  "studio",
        "summary":  "United Game Artists (UGA) was a Japanese video game development division of Sega. Formed from Sega AM9, UGA was known for developing innovative rhythm and action games including Space Channel 5 and Rez. The studio was merged into Sonic Team in 2003.",
        "founded":  2000,
        "defunct":  2003,
        "status":  "defunct",
        "focus":  "Rhythm games and experimental titles",
        "wikipediaUrl":  "https://en.wikipedia.org/wiki/United_Game_Artists",
        "wikidataId":  "Q6131461",
        "thumbnail":  null
    },
    {
        "id":  "system-16",
        "label":  "Sega System 16",
        "group":  "platform",
        "summary":  "The Sega System 16 is an arcade system board released by Sega in 1985. It was one of Sega\u0027s most successful and widely used arcade platforms, powering numerous classic titles. The board used a Motorola 68000 CPU and featured advanced sprite scaling and rotation capabilities for its era.",
        "releaseYear":  1985,
        "generation":  "16-bit era",
        "notableFeatures":  "Motorola 68000 CPU, hardware sprite scaling, tilemap graphics",
        "wikipediaUrl":  "https://en.wikipedia.org/wiki/List_of_Sega_arcade_system_boards",
        "wikidataId":  "Q909109",
        "thumbnail":  null
    },
    {
        "id":  "system-24",
        "label":  "Sega System 24",
        "group":  "platform",
        "summary":  "The Sega System 24 is an arcade system board released by Sega in 1988. It featured improved graphics capabilities over the System 16, with support for higher resolution displays and more complex sprite handling. Used for games like Gain Ground and Bonanza Bros.",
        "releaseYear":  1988,
        "generation":  "16-bit era",
        "notableFeatures":  "Dual 68000 CPUs, higher resolution display, floppy disk loading",
        "wikipediaUrl":  "https://en.wikipedia.org/wiki/List_of_Sega_arcade_system_boards",
        "wikidataId":  "Q6147678",
        "thumbnail":  null
    },
    {
        "id":  "system-32",
        "label":  "Sega System 32",
        "group":  "platform",
        "summary":  "The Sega System 32 is an arcade system board released by Sega in 1990. It was one of the most powerful 2D arcade boards of its time, capable of advanced sprite scaling, rotation, and multi-layer scrolling effects. Notable for being one of the first boards to display Sonic the Hedgehog.",
        "releaseYear":  1990,
        "generation":  "32-bit era",
        "notableFeatures":  "NEC V60 CPU, advanced 2D sprite effects, multi-layer scrolling",
        "wikipediaUrl":  "https://en.wikipedia.org/wiki/List_of_Sega_arcade_system_boards",
        "wikidataId":  "Q3030992",
        "thumbnail":  null
    },
    {
        "id":  "x-board",
        "label":  "Sega X Board",
        "group":  "platform",
        "summary":  "The Sega X Board is an arcade system board released by Sega in 1987. It was capable of surface and sprite rotation, enabling pseudo-3D effects for fast-paced action games. The board powered several of Sega\u0027s most iconic taikan (body sensation) motion simulator arcade cabinets.",
        "releaseYear":  1987,
        "generation":  "Super Scaler era",
        "notableFeatures":  "Sprite rotation, surface scaling, taikan motion cabinet support",
        "wikipediaUrl":  "https://en.wikipedia.org/wiki/List_of_Sega_arcade_system_boards",
        "wikidataId":  "Q11703697",
        "thumbnail":  null
    },
    {
        "id":  "y-board",
        "label":  "Sega Y Board",
        "group":  "platform",
        "summary":  "The Sega Y Board is an arcade system board released by Sega in 1988. An enhanced successor to the X Board, it featured improved sprite scaling and rotation capabilities. The board was used in Sega\u0027s most ambitious taikan arcade cabinets of the late 1980s.",
        "releaseYear":  1988,
        "generation":  "Super Scaler era",
        "notableFeatures":  "Enhanced sprite scaling, 3D rotation effects, 60fps capability",
        "wikipediaUrl":  "https://en.wikipedia.org/wiki/List_of_Sega_arcade_system_boards",
        "wikidataId":  "Q11703698",
        "thumbnail":  null
    },
    {
        "id":  "model-1",
        "label":  "Sega Model 1",
        "group":  "platform",